"code","term","definition","non-imdrf code/term","status","status description","codehierarchy","non-imdrf code","primary category","secondary category"
"C1004","Software Installation Problem Identified","The device software was not installed as per the specifications or failed to properly install.","","","","C10|C1004",,,
"C1005","Software Requirement Error","The software requirements for the device are either incomplete, inadequate, or in conflict.","","","","C10|C1005",,,
"C1006","Software Runtime Error","The device software failed during operation as a result of a coding error.","","","","C10|C1006",,,
"C1007","Software Security Vulnerability","The device software failed to provide adequate authorization, access control, protection and accountability features.","","","","C10|C1007",,,
"C1008","Erroneous Data Transfer","The device software fails to transfer the expected data within a system or to another device.","","","","C10|C1008",,,
"C1009","Data Storage or Loss of Data","Storage of data was unsuccessful in total or in part.","","","","C10|C1009",,,
"C11","Thermal Problem","Problems related to the temperature of the device. Note: For problems related to environmental temperature use ''Environment Problem Identified''.","","","","C11",,,
"C1101","Overheating Problem Identified","The device was found to become hotter than expected during operation. This applies to devices which are not intended to deliver heat. Use ""Excessive heating identified"" for devices which are intended to deliver heat during operation. Use ""Inadequate cooling identified"" if the overheating was related to a problem with a cooling system.","","","","C11|C1101",,,
"C1102","Excessive Heating Identified","The device delivered more heat than intended or expected during operation. This applies to devices which are intended to deliver heat. Use ""Overheating problem identified"" for devices which are not intended to deliver heat during operation.","","","","C11|C1102",,,
"C1103","Excessive Cooling Identified","The device cooled the patient or another device more than intended or expected during operation.","","","","C11|C1103",,,
"C1104","Inadequate Cooling Identified","The device did not sufficiently cool the patient or another device during operation.","","","","C11|C1104",,,
"C12","Protective System Problem Identified","Problems related to the system(s) designed to prevent or warn about unsafe operation of the device.","","","","C12",,,
"C1201","Fail-safe Problem Identified","A system intended to prevent unsafe operation of the device did not operate correctly.","","","","C12|C1201",,,
"C1202","Alarm System Problem Identified","A system intended to warn of a potentially unsafe condition did not operate correctly.","","","","C12|C1202",,,
"C1203","Problem of Device to Self-Test","Malfunction of the device's self-test system.","","","","C12|C1203",,,
"C1204","Problem to Auto Stop","An auto stop function of a device did not operate correctly.","","","","C12|C1204",,,
"C1205","Premature Indicator Activation","A system intended to indicate the device status was triggered prematurely.","","","","C12|C1205",,,
"C1206","Reset Problem","The device does not reset properly.","","","","C12|C1206",,,
"C1207","Shielding Problem","Inadequate shielding of/by the device.","","","","C12|C1207",,,
"C1208","Missing or Inadequate Safety Measures","Safety measures are inadequately applied or missing.","","","","C12|C1208",,,
"C13","Operational Problem Identified","Problems that occur during the performance, use, or functioning of the device.","","","","C13",,,
"C1301","Device Incorrectly Reprocessed","Problems associated with the failure to properly and adequately reprocess the device.","","","","C13|C1301",,,
"C130101","Device Incorrectly Cleaned During Reprocessing","The cleaning procedure is not followed correctly or used inappropriate cleaning materials.","","","","C13|C1301|C130101",,,
"C130102","Device Incorrectly Disinfected/Sterilised During Reprocessing","The disinfection/sterilization process was incorrect and/or the wrong products for disinfection/sterilization were used.","","","","C13|C1301|C130102",,,
"C130103","Device Incorrectly Assembled During Reprocessing","Incorrect assembly of the device following reprocessing.","","","","C13|C1301|C130103",,,
"C1302","Failure to Calibrate","A device that cannot calibrate (establish the relationship between a measuring device and the units of measure) to ensure accurate readings.","","","","C13|C1302",,,
"C1303","Device Difficult to Operate","Problems including set-up, operation, and disassembly of equipment. Not including reprocessing.","","","","C13|C1303",,,
"C1304","Incorrect Interpretation of Results/Data","Problems resulting from the incorrect interpretation by the user of the results or data provided by the device.","","","","C13|C1304",,,
"C14","Patient Sample Problem","Problems that occurred due to endogenous or exogenous interferent in the sample, or unexpected variation in the target analyte/marker.","","","","C14",,,
"C1401","New or Unknown Interferent","New or unknown endogenous or exogenous interferent (sample) identified.","","","","C14|C1401",,,
"C1402","Known Interferent","Known interferent in the sample identified.","","","","C14|C1402",,,
"C1403","Change in Target Marker/Variant/ Mutant","Problem due to change in target marker/variant/mutant which is not covered in the labelling.","","","","C14|C1403",,,
"C1404","Pre-analytical Handling Problem","Incorrect pre-analytical handling of patient's sample by the user.","","","","C14|C1404",,,
"C15","Environment Problem Identified","Problems that occurred due to factors within the environment e.g. dust, dirt, humidity, temperature.","","","","C15",,,
"C1501","Environmental Temperature Problem Identified","Device performance was affected by the temperature, or changes in temperature, of the environment in which it was used.","","","","C15|C1501",,,
"C1502","Dust or Dirt Problem Identified","A device that experienced problems due to ingress, or coating, of dust or dirt.","","","","C15|C1502",,,
"C1503","Contamination of Environment by Device","Operation of the device results in contamination of the nearby environment e.g. dust, dirt, smoke, heat or biological material.","","","","C15|C1503",,,
"C1504","Environmental Pressure Problem Identified","Device performance was affected by the pressure, or changes in pressure, of the environment in which it was used.","","","","C15|C1504",,,
"C1505","Ambient Light Problem Identified","Device performance was affected by ambient light. This term applies to the direct effects of ambient light on the device, and to the user's ability to operate the device (e.g. to read device output).","","","","C15|C1505",,,
"C1506","Environmental Humidity Problem Identified","Device performance was affected by the humidity, or changes in humidity, of the environment in which it was used.","","","","C15|C1506",,,
"C16","Manufacturing Process Problem Identified","Problems with a device that can be traced to a problem in the manufacturing and/or production process.","","","","C16",,,
"C1601","Assembly Problem Identified","Problems that occurred because the device was assembled incorrectly.","","","","C16|C1601",,,
"C1602","Sterilization Problem Identified","Problems that occurred during terminal sterilization by the manufacturer.","","","","C16|C1602",,,
"C1603","Installation Problem Identified","A device that malfunctions because it was incorrectly installed, set-up, or configured (e.g. misconfiguration of an ""automatic"" defibrillator to ""semi-automatic"", thereby leading to failure).","","","","C16|C1603",,,
"C1604","Maintenance of Manufacturing Machinery","Problems caused by failure to maintain manufacturing equipment used to produce the device.","","","","C16|C1604",,,
"C1605","Packaging Problem Identified","Problems that occurred because of the device packaging.","","","","C16|C1605",,,
"C160501","Packaging Compromised","Problems that occurred because of a compromised packaging of the device (e.g. broken or incomplete seal).","","","","C16|C1605|C160501",,,
"C160502","Packaging Materials Problem","Problems that occurred because of the composition or type of packaging materials was inappropriate for the device.","","","","C16|C1605|C160502",,,
"C160503","Packaging Contains Unintended Material","Problems that occurred because unintended material was packaged with the device.","","","","C16|C1605|C160503",,,
"C160504","Packaging Contains Incorrect Device","Problems that occurred because the packaging contained an incorrect device.","","","","C16|C1605|C160504",,,
"C17","Maintenance Problem Identified","A device malfunction or problem that occurs after production because the device was not properly maintained according to the instructions (e.g. maintenance may be performed by user facility, distributor, or service provider).","","","","C17",,,
"C18","Transport/Storage Problem Identified","Problems was caused by transport or storage conditions.","","","","C18",,,
"C1801","Transport Problem Identified","Problems traced to how the device was transported e.g. temperature of shipping compartment or method of transportation.","","","","C18|C1801",,,
"C1802","Storage Problem Identified","Problems that result from storing the device in an uncontrolled or improper environment (e.g. moisture sensitive devices stored in a humid environment).","","","","C18|C1802",,,
"C19","No Device Problem Found","Reported problem cannot be reproduced during investigation.","","Modified (technical)","Definition of this term was clarified on 21 January 2021. For details, refer to comment No. 17 and 29 of the Change Log. (Old definition: ""The device either functioned as intended or a problem was not found."")","C19",,,
"C20","No Findings Available","Use when no investigation can be performed and therefore no results will be obtained.","","","","C20",,,
"C21","Results Pending Completion of Investigation","Investigation is ongoing and results are not yet available. Do not use this code if the investigation is complete.","","","","C21",,,
"C22","Appropriate Term/Code Not Available","Problems is not adequately described by any other term. Note: This code must not be used unless there is no other feasible code. The preferred term should be documented when submitting an adverse event report. This information will be used to determine if a new term should be added to the code table.","","","","C22",,,
"C23","Usage Problem Identified","Problems that occurred related to the actions of a healthcare professional, patient, or other device user.","","New","Term was added on 21 January 2021 for coding device usage problems. For details, refer to comment No. 32 of the Change Log.","C23",,,
"A01","Patient Device Interaction Problem","Problem related to the interaction between the patient and the device.","","","","A01",,,
"A0101","Patient-Device Incompatibility","Problem associated with the interaction between the patient's physiology or anatomy and the device that affects the patient and/or the device.","","","","A01|A0101",,,
"A010101","Biocompatibility","Problem associated with undesirable local or systemic effects due to exposure to medical device materials or leachates from those materials by a patient who has an implant or is receiving treatment with a device made from them.","","","","A01|A0101|A010101",,,
"A010102","Device Appears to Trigger Rejection","The device appears to elicit undesired response in the patient to the presence of an implanted or invasive device, without inherent device failure, e.g. fibrous encapsulation, or inflammation of the tissue around the device, or extrusion of the device.","","","","A01|A0101|A010102",,,
"A010103","Inadequacy of Device Shape and/or Size","The physical size and/or shape of the device was inadequate with regard to the patient's anatomy.","","","","A01|A0101|A010103",,,
"A0102","Osseointegration Problem","Problem associated with interconnection between the bone tissue and the implanted device.","","","","A01|A0102",,,
"A010201","Failure to Osseointegrate","Problem associated with the failure to see direct anchorage of an implant by the formation of bony tissue around the implant without the growth of fibrous tissue at the bone-implant interface.","","","","A01|A0102|A010201",,,
"A010202","Loss of Osseointegration","Problem associated with weakened integration of the device at the bone-implant interface due to loss of fibrous and/or bony tissue and leading to compromised anchorage of the device. i.e. Loosening/Lysis","","","","A01|A0102|A010202",,,
"A0103","Loosening of Implant Not Related to Bone-Ingrowth","Problem associated with the loss of direct anchorage of an implanted device over time or due to an injury.","","","","A01|A0103",,,
"A0104","Migration or Expulsion of Device","Problem with an implanted or invasive device moving within the body, or being completely expelled from the body.","","","","A01|A0104",,,
"A010401","Expulsion","Problem with all or part of an implanted or invasive device being completely expelled from its intended location within the body.","","","","A01|A0104|A010401",,,
"A010402","Migration","Problem with all or part of an implanted or invasive device moving from its intended location within the body.","","","","A01|A0104|A010402",,,
"A02","Manufacturing, Packaging or Shipping Problem","Problem associated with any deviations from the documented specifications of the device that relate to nonconformity during manufacture to the design of an item or to specified manufacturing, packaging or shipping processes (out of box problem).","","","","A02",,,
"A0201","Product Quality Problem","Problem associated with an inherent device characteristic that is not satisfactory as specified or delivered.","","","","A02|A0201",,,
"A020101","Dull, Blunt","Problem associated with a device not being as sharp as intended or expected.","","","","A02|A0201|A020101",,,
"A020102","Nonstandard Device","Problem associated with the device that does not meet the specifications or requirements for which it was manufactured (e.g. materials, parts, manufacturing process).","","","","A02|A0201|A020102",,,
"A0202","Defective Component","Problem associated with a device component having flaws of dimensional deviations greater than acceptable for the intended use.","","","","A02|A0202",,,
"A0203","Defective Device","Problem associated with having flaws or dimensional deviations greater than acceptable for the intended use of the device.","","","","A02|A0203",,,
"A0204","Device Damaged Prior to Use","Problem associated with packaging or shipping damage prior to the use of the device.","","","","A02|A0204",,,
"A0205","Packaging Problem","Problem associated with the materials used to construct the cover or outer wrapping of the device.","","","","A02|A0205",,,
"A020501","Difficult to Open or Remove Packaging Material","Problem associated with difficulty for users to operate the device, specifically as it relates to the opening or removal of the outer wrapping.","","","","A02|A0205|A020501",,,
"A020502","Incomplete or Missing Packaging","Problem associated with the nonconformance to the device specifications due to incomplete or missing packaging that may compromise the device operation as intended.","","","","A02|A0205|A020502",,,
"A020503","Unsealed Device Packaging","Problem associated with the loss of packaging seal.","","","","A02|A0205|A020503",,,
"A020504","Tear, Rip or Hole in Device Packaging","Problem associated with packaging damage (tear, rip or hole) prior to the use of the device.","","","","A02|A0205|A020504",,,
"A0206","Device Misassembled During Manufacturing /Shipping","A device found incorrectly assembled when delivered to the user facility.","","","","A02|A0206",,,
"A020601","Component Misassembled","A device found to have one or more components incorrectly assembled when delivered to the user facility.","","","","A02|A0206|A020601",,,
"A020602","Component Missing","A device component(s) found to be missing when delivered to the user facility.","","","","A02|A0206|A020602",,,
"A0207","Shipping Damage or Problem","Problem associated with shipping damage or problem prior to the use of the device.","","","","A02|A0207",,,
"A020701","Delivered as Unsterile Product","Problem associated with a device being received in such a manner to indicate that its sterility has been compromised (e.g. sterile packaging breached, visible contaminate present)","","","","A02|A0207|A020701",,,
"A03","Chemical Problem","Problem associated with any from the documented specifications of the device that relate to any chemical characterization, i.e., element, compound, or mixture.","","","","A03",,,
"A0301","Device Emits Odor","Problem associated with an unexpected or inappropriate smell released by the device.","","","","A03|A0301",,,
"A0302","Device Ingredient or Reagent Problem","Problem associated with any deviations from the documented specifications of the device that relate to any ingredient or reagent characterization.","","","","A03|A0302",,,
"A030201","Clumping in Device or Device Ingredient","Problem associated with the aggregation of particles into irregular masses.","","","","A03|A0302|A030201",,,
"A030202","Coagulation in Device or Device Ingredient","Problem associated with the undesired characterization of congealing, solidifying, thickening, curdling.","","","","A03|A0302|A030202",,,
"A030203","Precipitate in Device or Device Ingredient","Problem associated with the separation of solid particles from a liquid as the result of a chemical or physical change.","","","","A03|A0302|A030203",,,
"A030204","Cross Reactivity","Problem associated with the degree to which an antibody or antigen participates in cross reactions.","","","","A03|A0302|A030204",,,
"A030205","Particulates","Substances that consist of separate particles that are introduced by the device during use.","","","","A03|A0302|A030205",,,
"A030206","High pH","pH higher than expected and/or anticipated.","","","","A03|A0302|A030206",,,
"A030207","Low pH","pH lower than expected and/or anticipated.","","","","A03|A0302|A030207",,,
"A030208","Unexpected Color","Color of product is different from that expected.","","New","Term was added on 18 March 2020 as an additional level 3 term under ""Device Ingredient or Reagent Problem"".","A03|A0302|A030208",,,
"A0303","Improper Chemical Reaction","Problem associated with an unexpected or incomplete chemical reaction or effect.","","","","A03|A0303",,,
"A04","Material Integrity Problem","Problem associated with any deviations from the documented specifications of the device that relate to the limited durability of all material used to construct device.","","","","A04",,,
"A0401","Break","Problem associated with undesired damage or breakage of those materials used in the device construction.","","","","A04|A0401",,,
"A040101","Fracture","Problem associated with a partial or full-thickness crack in the device materials.","","","","A04|A0401|A040101",,,
"A040102","Loss of or Failure to Bond","Problem associated with lack or loss of adherence between materials intended to be joined together by an adhesive.","","","","A04|A0401|A040102",,,
"A040103","Material Fragmentation","Problem associated with small pieces of the device breaking off unexpectedly.","","","","A04|A0401|A040103",,,
"A040104","Solder Joint Fracture","Problem associated with undesired damage or breakage in a solder joint of materials used in the device construction.","","","","A04|A0401|A040104",,,
"A0402","Burst Container or Vessel","Problem associated with the pressure inside a vessel or container rising to such a degree that the container ruptures.","","","","A04|A0402",,,
"A0403","Explosion","Problem associated with the violent bursting due to the sudden expansion of air, gas or fluid.","","","","A04|A0403",,,
"A0404","Crack","Problem associated with an undesired partial separation and/or a visible opening along the length or width in the materials that are used in the device construction.","","","","A04|A0404",,,
"A0405","Degraded","Problem associated with a undesired change in the chemical structure, physical properties, or appearance in the materials that are used in the device construction.","","","","A04|A0405",,,
"A040501","Calcified","Problem associated with buildup of calcium salts on the device.","","","","A04|A0405|A040501",,,
"A040502","Corroded","Problem associated with the chemical or electrochemical reaction between materials, usually a metal and its environment that produces a deterioration of the metal and its properties.","","","","A04|A0405|A040502",,,
"A040503","Material Erosion","Problem associated with a progressive loss of a material from a solid surface.","","","","A04|A0405|A040503",,,
"A040504","Pitted","Problem associated with the corrosion of a material's surface, confined to a point or small area that takes the form of cavities.","","","","A04|A0405|A040504",,,
"A040505","Flaked","Problem associated with the detachment of small pieces of the coating film of a material.","","","","A04|A0405|A040505",,,
"A040506","Peeled/Delaminated","Peeling or delamination of composite materials, including coatings, that occurs when layers are separated as a result of stress or impact and resulting in loss of mechanical toughness.","","","","A04|A0405|A040506",,,
"A040507","Naturally Worn","Problem associated with material damage to a surface, usually involving progressive loss or displacement of material, due to relative motion between that surface and a contacting substance or substances.","","","","A04|A0405|A040507",,,
"A040508","Unraveled Material","Problem due to the undesired unravelling of material (e.g. disentangled, unwound etc.).","","","","A04|A0405|A040508",,,
"A0406","Material Deformation","Problem associated with an undesired material change in shape or property caused by external forces.","","","","A04|A0406",,,
"A040601","Deformation Due to Compressive Stress","Problem associated with an undesired bulge, bend, bow, kink, or wavy condition observed in the device material resulting from compressive stresses.","","","","A04|A0406|A040601",,,
"A040602","Dent in Material","Problem associated with a undesired change in shape, characterized by the presence of a slight hollow (dent) in the device surface.","","","","A04|A0406|A040602",,,
"A040603","Failure to Fold","Problem associated with an undesired material change in physical property, characterized by failure to fold.","","","","A04|A0406|A040603",,,
"A040604","Failure to Unfold or Unwrap","Problem associated with the comprising materials' deformation in that device fails to open its wrapping or open/extend in a certain manner i.e. balloon or lens.","","","","A04|A0406|A040604",,,
"A040605","Material Frayed","Problem associated with the comprising materials having damaged edges.","","","","A04|A0406|A040605",,,
"A040606","Material Invagination","Problem associated with an undesired material change in shape, characterized by the infolding of one part within another part of a structure.","","","","A04|A0406|A040606",,,
"A040607","Material Too Rigid or Stiff","Problem associated with an undesired material change in physical property, characterized by rigidity (it resists deformation in response to an applied force).","","","","A04|A0406|A040607",,,
"A040608","Material Too Soft/Flexible","Problem associated with any device material that results in the material's inability to maintain the desired shape or support function.","","","","A04|A0406|A040608",,,
"A040609","Material Twisted/Bent","Problem associated with deformations that lead to twisting or bending of the device.","","","","A04|A0406|A040609",,,
"A040610","Melted","Problem associated with a solid device being transformed into a molten or liquid state.","","","","A04|A0406|A040610",,,
"A040611","Stretched","Problem associated with an increase or elongation in a materials' dimension.","","","","A04|A0406|A040611",,,
"A040612","Thickening of Material","Device is thickened due to deformation. Note: Not to be used for thickening of liquid.","","New","Term was added on 18 March 2020 as an additional level 3 term under ""Material Deformation"".","A04|A0406|A040612",,,
"A0407","Material Discolored","Problem associated with an undesired streak, pattern and/or a noticeable change in color from the rest of the materials used in the device construction.","","","","A04|A0407",,,
"A0408","Material Disintegration","Problem associated with material breaking into small particles.","","","","A04|A0408",,,
"A0409","Material Opacification","Problem associated with an undesirable opaqueness or cloudiness.","","","","A04|A0409",,,
"A0410","Material Perforation","Material constituting device is perforated possibly compromising the device's intended purpose.","","","","A04|A0410",,,
"A041001","Material Puncture/Hole","Device material(s) punctured leading to undesired holes/openings.","","","","A04|A0410|A041001",,,
"A0411","Material Protrusion/Extrusion","Problem associated with undesired physical appearance of device material, specifically when material extends beyond or above device surface.","","","","A04|A0411",,,
"A0412","Material Rupture","Problem associated with perforations that lead to bursting of the device.","","","","A04|A0412",,,
"A0413","Material Separation","Problem associated with an undesired disassociation or breaking apart of the device.","","","","A04|A0413",,,
"A0414","Material Split, Cut or Torn","Problem associated with materials consisting the device are split, cut or torn due to external forces (e.g. wrenching or laceration) or internal forces (e.g. exceeding the tensile stress limits belonging to the materials used in the device construction).","","","","A04|A0414",,,
"A0415","Scratched Material","Problem associated with an undesirable shallow cut or narrow groove in the surface of the device materials.","","","","A04|A0415",,,
