"code","term","definition","non-imdrf code/term","status","status description","codehierarchy","non-imdrf code","primary category","secondary category"
"A141202","Increased Pump Speed","Unintended increase in pump speed and hence, probably, flow rate, compromising the intended function of the device.","","","","A14|A1412|A141202",,,
"A141203","Failure to Pump","Problem associated with the device which fails to start pumping.","","","","A14|A1412|A141203",,,
"A141204","Pumping Stopped","Unexpected/unintended cessation of pump.","","","","A14|A1412|A141204",,,
"A1413","Suction Problem","Problem associated with suction equipment, which may be a manual, electrical, vacuum or pressure source operated to evacuate and remove undesired substances (air, gas, fluid, or particulates) via tubing and collection bag.","","","","A14|A1413",,,
"A141301","Decrease in Suction","Problem associated with the removal of fluid or gas from a body cavity or device due to decreased suction.","","Modified (technical)","Technical change to the definition on 18 March 2020 to include removal of fluid or gas from a device.","A14|A1413|A141301",,,
"A141302","Increase in Suction","Problem associated with the removal of fluid or gas from a body cavity or device due to increased suction.","","Modified (technical)","Technical change to the definition on 18 March 2020 to include removal of fluid or gas from a device.","A14|A1413|A141302",,,
"A141303","Suction Failure","Problem associated with the complete inability to provide suction.","","","","A14|A1413|A141303",,,
"A1414","Priming Problem","Problem associated with the preparation of the device to begin pumping.","","","","A14|A1414",,,
"A141401","Failure to Prime","Problem associated with the device failing to begin the priming process (i.e. the process of preparation of device for the delivery of fluids).","","","","A14|A1414|A141401",,,
"A141402","Incomplete or Inadequate Priming","Problem associated with not adequately preparing the device.","","","","A14|A1414|A141402",,,
"A1415","Air/Gas in Device","Problem associated with air in the device (e.g. air in line).","","New","Term was added on 18 March 2020 as an additional level 2 term to ""Infusion or Flow Problem"".","A14|A1415",,,
"A15","Activation, Positioning or Separation Problem","Problem associated with any deviations from the documented specifications of the device that relate to the sequence of events for activation, positioning or separation of device. Note: Deployment is synonymous with activation.","","Modified (editorial)","Editorial change to the term on 16 Feburary 2021.","A15",,,
"A1501","Activation Problem","Problem associated with the activation of the device. Note: Activation includes expansion.","","Modified (technical)","Technical change to the definition on 18 March 2020 to clarify that activation includes expansion.","A15|A1501",,,
"A150101","Activation Failure","Problem associated with the device failing to be activated including partial activation.","","Modified (editorial)","Editorial change to the definition on 18 March 2020.","A15|A1501|A150101",,,
"A150102","Difficult or Delayed Activation","Problem associated with delayed or difficult activation of the device.","","","","A15|A1501|A150102",,,
"A150103","Premature Activation","Problem associated with early and unexpected activation of the device.","","","","A15|A1501|A150103",,,
"A150104","Self-Activation or Keying","Problem associated with the unintended activation of the device, or the device having been unexpectedly turned on during use.","","","","A15|A1501|A150104",,,
"A150105","Key or Button Unresponsive/not Working","Problem associated with a device not responding to key or button inputs.","","New","Term was added on 18 March 2020 as an additional level 3 term to ""Activation Problem"".","A15|A1501|A150105",,,
"A1502","Positioning Problem","Problem associated with the movement of the device to an intended location.","","","","A15|A1502",,,
"A150201","Positioning Failure","Problem associated with the inability of the device to be positioned in a specified location.","","","","A15|A1502|A150201",,,
"A150202","Malposition of Device","Problem associated with the device being positioned in a location other than intended or specified.","","","","A15|A1502|A150202",,,
"A150203","Difficult or Delayed Positioning","Problem associated with users experiencing difficulty or delay to position the device to a specified location.","","","","A15|A1502|A150203",,,
"A150204","Failure to Advance","Problem associated with failure to move the device to an intended location.","","","","A15|A1502|A150204",,,
"A150205","Difficult to Advance","Problem associated with difficulty moving the device to an intended location (e.g. difficulty in advancing guide wire).","","","","A15|A1502|A150205",,,
"A150206","Difficult to Insert","Problem associated with problems introducing or inserting the device, even if the user is operating the device in accordance with the instructions for use or labeling.","","","","A15|A1502|A150206",,,
"A150207","Difficult to Remove","Problem associated with the user experiencing difficulty when taking out the device, even if the user is operating device in accordance with the instructions for use or labeling.","","Modified (editorial)","Editorial change to the definition on 18 March 2020.","A15|A1502|A150207",,,
"A150208","Entrapment of Device","Problem associated with the device caught within patient vasculature, tissue, or other device.","","","","A15|A1502|A150208",,,
"A1503","Separation Problem","Problem associated with the detachment or separation of the device.","","","","A15|A1503",,,
"A150301","Separation Failure","Problem associated with the device or one of its components failing to detach or separate as intended.","","","","A15|A1503|A150301",,,
"A150302","Difficult or Delayed Separation","Problem associated with users experiencing difficulty or delay with detachment or separation of the device.","","","","A15|A1503|A150302",,,
"A150303","Premature Separation","Problem associated with an early and unexpected detachment or separation of the device from the system.","","","","A15|A1503|A150303",,,
"A16","Protective Measures Problem","Problem associated with any deviations from the documented specifications of the device that relate to the implemented and inherited design features specific to devices used for reducing risks to patient or caregiver or maintaining risks within specified levels.","","","","A16",,,
"A1601","Device Alarm System","Problem associated with the alarm system of the device.","","","","A16|A1601",,,
"A160101","Alarm Not Visible","The device does not display an alarm message when required.","","","","A16|A1601|A160101",,,
"A160102","No Audible Alarm","The device fails to emit an audible alarm.","","","","A16|A1601|A160102",,,
"A160103","Low Audible Alarm","The audible device alarm cannot be heard clearly.","","","","A16|A1601|A160103",,,
"A160104","Delayed Alarm","The device alarm system operates with delay.","","","","A16|A1601|A160104",,,
"A160105","False Alarm","Problem associated with the device providing incorrect alarm warning or alert to user.","","","","A16|A1601|A160105",,,
"A160106","Defective Alarm","The device alarm does not operate as expected and/or in agreement with device's specifications.","","","","A16|A1601|A160106",,,
"A1602","Fail-Safe Problem","Problem associated with the feature that prevents the unsafe use of the device.","","","","A16|A1602",,,
"A160201","Fail-Safe Did Not Operate","Problem associated with the device fail-safe mechanism, which did not function or function in a non effective way, compromising safe use of the device.","","","","A16|A1602|A160201",,,
"A160202","No Fail-Safe Mechanism","The device does not have a fail-safe mechanism, although such mechanism would be required for its appropriate and/or safe functioning.","","","","A16|A1602|A160202",,,
"A1603","Failure of Device to Self-Test","Problem associated with the device failing to perform an internal self-diagnostic process to ensure normal operation during or prior to use.","","","","A16|A1603",,,
"A1604","Failure to Auto Stop","Problem associated with the inability of device to turn itself off when the device is not in an operable condition.","","","","A16|A1604",,,
"A1605","Reset Problem","Problem associated with setting a variable, register, or other storage location back to a prescribed state.","","","","A16|A1605",,,
"A160501","Failure to Reset","Problem associated with the device failing to set a variable, register, or other storage location back to a prescribed state.","","","","A16|A1605|A160501",,,
"A160502","Failure to Zero","Problem associated with the device failing to set a variable, register, or other storage location back to zero.","","","","A16|A1605|A160502",,,
"A160503","Inappropriate or Unexpected Reset","Problem associated with the device setting a variable, register, or other storage location to an inappropriate or unexpected state.","","","","A16|A1605|A160503",,,
"A1606","Premature Indicator Activation","Problems with the activation of a protective measure indicator earlier than expected.","","","","A16|A1606",,,
"A160601","Premature Elective Replacement Indicator","Problems with the early or unexpected activation of the elective replacement indicator.","","","","A16|A1606|A160601",,,
"A160602","Premature End-of-Life Indicator","Problem with the early or unexpected activation of the end-of-life indicator.","","","","A16|A1606|A160602",,,
"A1607","Shielding Failure","Problem associated with the device inability to act as a barrier for absorption of radiation energy in X-rays, gamma rays, etc.","","","","A16|A1607",,,
"A17","Compatibility Problem","Problem associated with compatibility between device, patients or substances (medication, body fluid, etc.)","","","","A17",,,
"A1701","Component or Accessory Incompatibility","Problem associated with the incompatibility of any device while being operated in the same use environment thereby leading to a dysfunction between the devices.","","","","A17|A1701",,,
"A170101","Accessory Incompatible","An accessory required for the intended purpose of the device appears incompatible with device, thus compromising the intended function of the device.","","","","A17|A1701|A170101",,,
"A170102","Component Incompatible","A component required for the proper functioning of the device is not compatible with other components or subassemblies of the device, thus compromising the intended function of the device.","","","","A17|A1701|A170102",,,
"A1702","Device-Device Incompatibility","Problem associated with the incompatibility of two or more devices while being operated in the same use environment thereby leading to a dysfunction of more than one device.","","","","A17|A1702",,,
"A1703","Measurement System Incompatibility","Problem associated with the incompatibility of the measurement systems between and/or within device systems that are inherent to the individual device thereby leading to miscalculated or mismatched measurements from those devices, e.g., international metric system versus U.S. measurement system.","","","","A17|A1703",,,
"A1704","Unintended Compatibility","Problem associated with the ability of two or more devices which are intended to be incompatible but are able to work or fit together.","","","","A17|A1704",,,
"A18","Contamination /Decontamination Problem","Problem associated with the presence of any unexpected foreign substance found in the device, on its surface or in the package materials, which may affect performance or intended use of the device, or problem that compromise effective decontamination of the device.","","","","A18",,,
"A1801","Contamination","Problem associated with the undesired introduction of impurities either chemical or microbiological in nature, or of foreign matter into or onto the device.","","Modified (technical)","Technical change to the term on 18 March 2020 to separate when/where contamination occurred from type of contamination (""During Use"" was removed). NOTE: This change affects all lower level terms (A180101 - A180105) which are also no longer limited to contamination during use.","A18|A1801",,,
"A180101","Biofilm coating in Device","Problem associated with the undesired introduction of a biofilm coating into or onto the device.","","","","A18|A1801|A180101",,,
"A180102","Contamination of Device Ingredient or Reagent","Problem associated with the undesired introduction of impurities either chemical or microbiological in nature, or of foreign matter into or onto the device ingredient or reagent.","","","","A18|A1801|A180102",,,
"A180103","Device Contamination with Body Fluid","Problem associated with the undesired presence of body fluid in/on the device, which are not part of the documented device specifications and requirements.","","","","A18|A1801|A180103",,,
"A180104","Device Contamination with Chemical or Other Material","Problem associated with contamination of the device with chemical substance or other non biologic material.","","","","A18|A1801|A180104",,,
"A180105","Microbial Contamination of Device","Problem associated with undesired microbial contamination of the device.","","","","A18|A1801|A180105",,,
"A1802","Device Contaminated During Manufacture or Shipping","Problem associated with the presence of any unexpected foreign substance found on the surface or in the package materials, which may affect optimal performance for its intended use, and which occurred during manufacture or shipping.","","Modified (technical)","Technical change to the definition on 18 March 2020 to clarify that contamination occurred during manufacture or shipping.","A18|A1802",,,
"A1803","Device Reprocessing Problem","Problem associated with a failure during any step of reprocessing process (cleaning, disinfection, packaging, labeling, sterilization) of a used or opened from its original packaging, but unused, device.","","","","A18|A1803",,,
"A180301","Failure to Clean Adequately","Problem associated with the failure of the device or operator to remove any visible soil, foreign material or organism deposits on the external surfaces, crevices, and joints of the device.","","","","A18|A1803|A180301",,,
"A180302","Failure to Disinfect","Failure to properly disinfect the device when reprocessing it.","","","","A18|A1803|A180302",,,
"A180303","Flushing Problem","Flushing process was not executed properly.","","","","A18|A1803|A180303",,,
"A180304","Problem with Removal of Enzymatic Cleaner","Enzymatic cleaner was not removed properly.","","","","A18|A1803|A180304",,,
"A180305","Problem with Sterilization","Device was not sterilized properly during reprocessing.","","","","A18|A1803|A180305",,,
"A180306","Residue After Decontamination","Problem associated with the decontamination process not adequately removing unwanted visible soil, foreign material, or organism deposits.","","","","A18|A1803|A180306",,,
"A1804","Device Contaminated at the User Facility","Problem associated with the presence of any unexpected foreign substance found on the surface or in the package materials, which may affect optimal performance for its intended use, and which occurred at the user facility.","","New","Term was added on 18 March 2020 for coding of contamination at the user facility which was originally included in ""Contamination During Use"" (A1801).","A18|A1804",,,
"A19","Environmental Compatibility Problem","Problem associated with the surrounding conditions in which the device is being used such as temperature, noise, lighting, ventilation, or other external factors such as power supply.","","","","A19",,,
"A1901","Ambient Noise Problem","Problem associated with any undesired acoustic energy or vibration that tends to interfere with the operation of the device.","","","","A19|A1901",,,
"A1902","Ambient Temperature Problem","Problem associated with compromised device performance at the ambient temperature or the storage at an inappropriate ambient temperature.","","","","A19|A1902",,,
"A1903","Fumes or Vapors","Problem associated with the visibility, odor, or toxicity of an ambient vapor or gas.","","","","A19|A1903",,,
"A1904","Fungus in Device Environment","Problem associated with the visibility of molds, mildews, yeasts, and/or mushrooms in the immediate environment in which the device is being used.","","","","A19|A1904",,,
"A1905","Moisture or Humidity Problem","Problem associated with an unsatisfactory humidity level in the storage or use environment which affects the device performance.","","","","A19|A1905",,,
"A190501","Moisture Damage","Problem associated with damage inflicted upon the device from water vapor or water in the immediate environment in which the device is being used.","","","","A19|A1905|A190501",,,
"A1906","Ventilation Problem in Device Environment","Problem associated with the circulation of fresh air in the immediate atmosphere in which the device is being used.","","","","A19|A1906",,,
"A190601","Fogging","Problem associated with the visibility of water vapor in the immediate atmosphere in which the device is being used.","","","","A19|A1906|A190601",,,
"A1907","Device Unsafe to Use in Environment","Problem associated with environmental condition that results in the unsafe use of the device. (e.g. electromagnetic fields, noise, vibration, microbiological contamination etc.)","","","","A19|A1907",,,
"A1908","Environmental Particulates","Problem associated with fine solids or liquid particles such as dust, smoke, fume, and/or mist suspended in the immediate atmosphere in which the device is being used.","","","","A19|A1908",,,
"A1909","Medical Gas Supply Problem","Problem associated with the facility-supplied medical gases such as medical air, oxygen, nitrous oxide, and nitrogen.","","","","A19|A1909",,,
"A1910","Electrical Power Problem","Problem associated with the quality of the facility-supplied power.","","","","A19|A1910",,,
"A191001","Emergency Power Failure","Problem associated with the failure of the facility's emergency power backup system(s) including generators and/or interruptible power systems (UPS).","","","","A19|A1910|A191001",,,
"A191002","Loss of Power","Problem associated with the failure of primary power supplied by the facility.","","","","A19|A1910|A191002",,,
"A191003","Power Conditioning Problem","Problem associated with a momentary overpower/over voltage from the utility and electrical systems of user facilities; - Problem associated with inadequate power conditioning such as the presence of fluctuation, surges, spikes, dropouts, noise and other such undesirable transients.","","","","A19|A1910|A191003",,,
"A20","Installation-Related Problem","Problem associated with unsatisfactory installation, configuration, and/or setup of a specific device.","","","","A20",,,
"A2001","Misassembled During Installation","Problem associated with the use of the device characterized by incorrect assembly of device components, parts or constituents.","","","","A20|A2001",,,
"A21","Labelling, Instructions for Use or Training Problem","Problem associated with device markings/labelling, instructions for use, training and maintenance documentation or guidelines.","","","","A21",,,
"A2101","Device Markings/Labelling Problem","Problem associated with the written, printed or graphic material accompanying or affixed to the device or any of its packaging. This includes verbal instructions relating to identification, technical description, and usage provided by the device manufacturers. Problems can include but are not limited to this material being unclear, missing, worn out, incorrect or inaccurate.","","","","A21|A2101",,,
"A210101","Expiration Date Error","Problem associated with errors in identification of expiration date.","","","","A21|A2101|A210101",,,
"A210102","Illegible Information","Problem associated with information unable to be read or deciphered.","","","","A21|A2101|A210102",,,
"A210103","Inaccurate Information","Problem associated with imprecise, inexact information.","","","","A21|A2101|A210103",,,
"A210104","Unclear Information","Problem associated with ambiguous, confused information.","","","","A21|A2101|A210104",,,
"A210105","Missing Information","Absence of information e.g. labeling, instruction for use.","","","","A21|A2101|A210105",,,
"A2102","Lack of Maintenance Documentation or Guidelines","Problem associated with user facility not receiving adequate service documentation, guidelines, or recommendations to perform preventative and corrective maintenance and performance assurance checks.","","","","A21|A2102",,,
"A2103","Inadequate Instructions for Healthcare Professional","Problem associated with inaccuracies in any written, printed, or graphic matter that is affixed to the device or its packaging with any matter that accompanies the device including verbal instructions related to identification, technical description and use of device provided by the device manufacturers that is intended for healthcare professionals.","","","","A21|A2103",,,
"A2104","Inadequate Instructions for Non-Healthcare Professional","Problem associated with users being unclear and not able to follow any written, printed, or graphic matter that is affixed to device or its packaging with any matter that accompanies the device including verbal instructions related to identification, technical description and use of the device provided by the device manufactures that vary from the standard of medical care in a given environment.","","","","A21|A2104",,,
"A2105","Inadequate or Insufficient Training","Problem associated with facility not providing satisfactory initial and/or periodic user training covering operation of the device.","","","","A21|A2105",,,
"A22","Human-Device Interface Problem","Problem associated with an act or omission of an act that has a different result than that intended by the manufacturer or expected by the operator.","","","","A22",,,
"A2201","Device Difficult to Setup or Prepare","Problem associated with the use of the device in terms of user experiencing difficulty in preparing device for use, even if the operation is being performed according to labeled instructions for use.","","","","A22|A2201",,,
"A2202","Device Difficult to Program or Calibrate","The device is difficult to program, calibrate or set to desired state, even by appropriately trained user/operator.","","","","A22|A2202",,,
"A2203","Device Difficult to Maintain","Problem associated with the user's ability to service the device according to the manufacturer specifications relating to the device routine maintenance, i.e., periodic inspection, failure detection, repair, and care of the device to sustain or restore acceptable operating conditions.","","","","A22|A2203",,,
"A2204","Inadequate User Interface","Problem associated with the means by which the operator and the equipment communicate or interact.","","","","A22|A2204",,,
"A23","Use of Device Problem","Problem associated with failure to process, service, or operate the device according to the manufacturer's recommendations or recognized best practices.","","","","A23",,,
"A2301","Device Handling Problem","Handling of the device not in accordance with specification, prior to use on the patient.","","","","A23|A2301",,,
"A2302","Use of Incorrect Control Settings","Problem associated with the use of the device in terms of inappropriate and false control setting for the device's specified operation and/or intended use.","","","","A23|A2302",,,
"A2303","Improper or Incorrect Procedure or Method","Problem associated with the use of the device in terms of nonconforming to that device's intended use, specifications, procedure and process or service instructions and information provided by the device manufacturers.","","","","A23|A2303",,,
"A2304","Off-Label Use","Problem associated with the device which has been used for an unapproved indication or for an unapproved intended use.","","","","A23|A2304",,,
"A2305","Misassembled","Problem associated with incorrect assembly of the device or constituents after being put into use.","","","","A23|A2305",,,
"A230501","Misassembly by Users","Problem associated with incorrect assembly of the device or constituents by the users.","","","","A23|A2305|A230501",,,
"A230502","Misassembly During Maintenance/Repair","Problem associated with incorrect assembly of the device or constituents during maintenance or repair.","","","","A23|A2305|A230502",,,
"A24","Adverse Event Without Identified Device or Use Problem","An adverse event (e.g. patient harm) appears to have occurred, but there does not appear to have been a problem with the device or the way it was used.","","","","A24",,,
"A25","No Apparent Adverse Event","A report has been received but the description provided does not appear to relate to an adverse event. This code allows a report to be recorded for administration purposes, even if it doesn't meet the requirements for adverse event reporting.","","","","A25",,,
"A26","Insufficient Information","An adverse event appears to have occurred but there is not yet enough information available to classify the device problem.","","","","A26",,,
"A27","Appropriate Term/Code Not Available","The device problem is not adequately described by any other term. Note: this code must not be used unless there is no other feasible code. The preferred term should be documented when submitting an adverse event report. This information will be used to determine if a new term should be added to the code table.","","","","A27",,,
"B01","Testing of Actual/Suspected Device","The investigation employed relevant empirical testing of the actual device suspected in the reported adverse event in order to establish their functional and other properties and to identify possible causes for the adverse event. Relevant testing would typically be based on test methods used for evaluating safety and performance as described in the latest relevant standards.","","","","B01",,,
