"code","term","definition","non-imdrf code/term","status","status description","codehierarchy","non-imdrf code","primary category","secondary category"
"E1017","Intra-Abdominal Hemorrhage","Bleeding within the abdominal cavity.",,"","","E10|E1017","MedDRA:10055291:Intra-abdominal hemorrhage","",""
"E1018","Laceration(s) of Esophagus","A torn, ragged, mangled wound, or an accidental cut of esophagus.",,"","","E10|E1018","MedDRA:10068164:Esophageal laceration","",""
"E1019","Melena","Abnormally dark tarry feces containing blood, usually from gastrointestinal bleeding.",,"","","E10|E1019","MedDRA:10027162:Melena","",""
"E1020","Nausea","Upper abdominal discomfort associated with an urge to vomit.",,"","","E10|E1020","MedDRA:10028813:Nausea","",""
"E1021","Pancreatitis","Inflammation of the pancreas.",,"","","E10|E1021","MedDRA:10033645:Pancreatitis","Gastrointestinal System","Infections"
"E1022","Perforation of Esophagus","The presence of a hole or other type of opening in the esophageal wall through which the contents of the esophagus can pass into the mediastinum.",,"","","E10|E1022","MedDRA:10034419:Perforation of esophagus","Gastrointestinal System","Procedural Complications"
"E1023","Peritoneal Laceration(s)","A cut or tear of the peritoneum.",,"","","E10|E1023","MedDRA:10068140:Peritoneal laceration","Gastrointestinal System","Injury"
"E1024","Peritonitis","Inflammation of the peritoneum due to infection by bacteria or fungi.",,"","","E10|E1024","MedDRA:10034674:Peritonitis","Gastrointestinal System","Infections"
"E1025","Pyrosis/Heartburn","Abdominal discomfort with retrosternal pain usually associated with gastroesophageal reflux.",,"","","E10|E1025","MedDRA:10019326:Heartburn","",""
"E1026","Rectal Anastomotic Leakage","Leakage due to breakdown of a rectal anastomosis.",,"","","E10|E1026","MedDRA:10065894:Rectal anastomotic leak","Gastrointestinal System","Procedural Complications"
"E1027","Retroperitoneal Hemorrhage","Bleeding originating in the retroperitoneal area.",,"","","E10|E1027","MedDRA:10038981:Retroperitoneal hemorrhage","",""
"E1028","Salivary Gland Problem","A non-neoplastic or neoplastic (benign or malignant) disorder involving a salivary gland.",,"","","E10|E1028","MedDRA:10061935:Salivary gland disorder","",""
"E102801","Dry Mouth","The condition of not having enough saliva to keep the mouth moist.",,"","","E10|E1028|E102801","MedDRA:10013781:Dry mouth","",""
"E102802","Salivary Hypersecretion","Excessive saliva production.",,"","","E10|E1028|E102802","MedDRA:10039424:Salivary hypersecretion","",""
"E1029","Stenosis of the esophagus","Narrowing or tightening of the esophagus",,"","","E10|E1029","MedDRA:10041978:Stenosis esophageal","",""
"E1030","Stomach Ulceration","The formation of sores or a break in the wall of the stomach.",,"","","E10|E1030","MedDRA:10042116:Stomach ulcer","",""
"E1031","Stomatitis","Inflammation of the oral mucosa.",,"","","E10|E1031","MedDRA:10042128:Stomatitis","",""
"E103101","Glossitis","Inflammation of the tongue.",,"","","E10|E1031|E103101","MedDRA:10018386:Glossitis","",""
"E1032","Vomiting","Forceful ejection of the contents of the stomach through the mouth.",,"","","E10|E1032","MedDRA:10047700:Vomiting","",""
"E1033","Unspecified Gastrointestinal Problem","The report describes a non-specific problem with the gastrointestinal system. Note: Please use ""Appropriate Term / Code Not Available"" if the report describes a specific problem but the relevant term does not exist.",,"New","Term was added on 18 March 2020 for cases where the category of a health effect was reported but with no further details.","E10|E1033","","",""
"E1303","Increased Intra-Peritoneal Volume (IIPV)","Abnormal build up of fluid in the abdomen.",,"","","E10|E1303","MedDRA:10082492:Increased intraperitoneal volume","Kidney and Urinary Tract","Gastrointestinal System"
"E1607","Difficulty Chewing","Problem with mastication due to pain, discomfort or loss of mobility in the jaw.",,"","","E10|E1607","MedDRA:10067464:Chewing difficulty","Musculoskeletal System","Gastrointestinal System"
"E11","Hepatic and Biliary System","Hepatic and Biliary System",,"Not selectable","Please use more detailed term within the hierarchy","E11","","",""
"E1101","Biliary Cirrhosis","Cirrhosis of the liver caused either by destruction of the intrahepatic bile ducts (primary biliary cholangitis) or blockage of the extrahepatic bile ducts (secondary biliary cholangitis).",,"Modified (editorial)","Definition was modified on 21 January 2021 (Old definition: Biliary Cirrhosis/Cirrhosis of the liver caused either by destruction of the intrahepatic bile ducts (primary biliary cirrhosis) or blockage of the extrahepatic bile ducts (secondary biliary cirrhosis).). For details, refer to comment No. 5 of the Change Log.","E11|E1101","MedDRA:10004659:Biliary cirrhosis","",""
"E1102","Hepatitis","Inflammation of the liver; usually from a viral infection, but sometimes from toxic agents.",,"","","E11|E1102","MedDRA:10056522:Hepatic infection","Hepatic and Biliary System","Infections"
"E1103","Hyperbilirubinemia","Abnormally high level of bilirubin in the blood. Excess bilirubin is associated with jaundice.",,"","","E11|E1103","MedDRA:10020582:Hyperbilirubinemia","",""
"E1104","Liver Damage/Dysfunction","Non traumatic damage to the liver parenchyma resulting in hepatic insufficiency.",,"","","E11|E1104","MedDRA:10019831:Hepatocellular damage","",""
"E1105","Liver Failure","Sustained, and severe damage to the liver with significant loss of function.",,"","","E11|E1105","MedDRA:10024678:Liver failure","",""
"E1106","Liver Laceration(s)","A cut or tear in the liver.",,"","","E11|E1106","MedDRA:10068143:Liver laceration","",""
"E1107","Unspecified Hepatic or Biliary Problem","The report describes a non-specific problem with the liver or biliary system. Note: Please use ""Appropriate Term / Code Not Available"" if the report describes a specific problem but the relevant term does not exist.",,"New","Term was added on 18 March 2020 for cases where the category of a health effect was reported but with no further details.","E11|E1107","","",""
"E12","Endocrine, Metabolism and Nutrition","Endocrine, Metabolism and Nutrition",,"Not selectable","Please use more detailed term within the hierarchy. NOTE: Term was modified on 18 March 2020 to include Endocrine.","E12","","",""
"E0739","Respiratory Acidosis","A condition in which the blood pH is less than normal, secondary to impaired gas exchange.",,"","","E12|E0739","MedDRA:10038661:Respiratory acidosis","Respiratory System","Endocrine, Metabolism and Nutrition"
"E0740","Respiratory Alkalosis","A condition in which the blood pH is greater than normal, secondary to impaired gas exchange.",,"","","E12|E0740","MedDRA:10038664:Respiratory alkalosis","Respiratory System","Endocrine, Metabolism and Nutrition"
"E1201","Dehydration","A condition resulting from the excessive loss of fluid from the body.",,"","","E12|E1201","MedDRA:10012174:Dehydration","",""
"E1202","Electrolyte Imbalance","Higher or lower than normal values for the serum electrolytes; usually affecting Na, K, Cl, Ca, CO2, BUN.",,"","","E12|E1202","MedDRA:10014418:Electrolyte imbalance","Endocrine, Metabolism and Nutrition","Blood and Lymphatic System"
"E120201","Hypernatremia","Higher than normal levels of sodium in the circulating blood.",,"","","E12|E1202|E120201","MedDRA:10020680:Hypernatremia","Endocrine, Metabolism and Nutrition","Blood and Lymphatic System"
"E120202","Hyponatremia","Lower than normal levels of sodium in the circulating blood.",,"","","E12|E1202|E120202","MedDRA:10021038:Hyponatremia","Endocrine, Metabolism and Nutrition","Blood and Lymphatic System"
"E1203","Feeding Problem","Interruption or disruption of the intake of food/nutrition.",,"","","E12|E1203","MedDRA:10061148:Feeding disorder","",""
"E1204","Hot Flashes/Flushes","A temporary and/or sudden feeling of intense body warmth, flushing, sometimes accompanied by sweating.",,"","","E12|E1204","MedDRA:10020407:Hot flashes","",""
"E1205","Hyperglycemia","Abnormally high level of glucose in the blood.",,"","","E12|E1205","MedDRA:10020639:Hyperglycemia","Endocrine, Metabolism and Nutrition","Investigations and Diagnostic Tests"
"E120501","Diabetic Ketoacidosis","A type of metabolic acidosis produced by accumulation of ketone bodies resulting from uncontrolled diabetes mellitus.",,"","","E12|E1205|E120501","MedDRA:10012671:Diabetic ketoacidosis","",""
"E1206","Hypoglycemia","Abnormally low level of glucose in the blood.",,"","","E12|E1206","MedDRA:10021005:Hypoglycemia","Endocrine, Metabolism and Nutrition","Investigations and Diagnostic Tests"
"E1207","Polydipsia","Extreme thirst accompanied by chronic excessive intake of water.",,"","","E12|E1207","MedDRA:10036067:Polydipsia","",""
"E1208","Weight Changes","Repetitive loss and regain of body weight.",,"","","E12|E1208","MedDRA:10049040:Weight fluctuation","",""
"E1209","Hormonal Imbalance","An imbalance of one or more hormones in the body",,"New","Term was added on 18 March 2020 as an additional level 2 term for ""Endocrine, Metabolism and Nutrition"".","E12|E1209","MedDRA:10020381:Hormonal imbalance","Endocrine, Metabolism and Nutrition","Investigations and Diagnostic Tests"
"E1210","Premature Menopause","Menopause occurring spontaneously before 40 years of age",,"New","Term was added on 18 March 2020 as an additional level 2 term for ""Endocrine, Metabolism and Nutrition"".","E12|E1210","MedDRA:10036601:Premature menopause","Endocrine, Metabolism and Nutrition","Reproductive System and Breast"
"E1211","Vitamin Deficiency","Low levels of one or more vitamins in the body.",,"New","Term was added on 18 March 2020 as an additional level 2 term for ""Endocrine, Metabolism and Nutrition"".","E12|E1211","MedDRA:10047628:Vitamin deficiency","",""
"E1306","Uremia","Abnormally high concentration of non-protein nitrogen in the blood.",,"","","E12|E1306","MedDRA:10046369:Uremia","Kidney and Urinary Tract","Endocrine, Metabolism and Nutrition"
"E2306","Decreased Appetite","Lack of desire for food.",,"","","E12|E2306","MedDRA:10061428:Decreased appetite","Generalized Disorders","Endocrine, Metabolism and Nutrition"
"E2307","Increased Appetite","Intense desire for food.",,"","","E12|E2307","MedDRA:10021654:Increased appetite","Generalized Disorders","Endocrine, Metabolism and Nutrition"
"E13","Kidney and Urinary Tract","Kidney and Urinary Tract",,"Not selectable","Please use more detailed term within the hierarchy","E13","","",""
"E1301","Dysuria","Difficult or painful urination.",,"","","E13|E1301","MedDRA:10013990:Dysuria","",""
"E1302","Hematuria","Blood in the urine.",,"","","E13|E1302","MedDRA:10019450:Hematuria","",""
"E1303","Increased Intra-Peritoneal Volume (IIPV)","Abnormal build up of fluid in the abdomen.",,"","","E13|E1303","MedDRA:10082492:Increased intraperitoneal volume","Kidney and Urinary Tract","Gastrointestinal System"
"E1304","Micturition Urgency","A sudden compelling urge to urinate.",,"","","E13|E1304","MedDRA:10027566:Micturition urgency","",""
"E1305","Renal Impairment","An acute or chronic condition where the kidneys are not functioning normally.",,"Modified (editorial)","Editorial change to the definition on 16 February 2021.","E13|E1305","MedDRA:10062237:Renal impairment","",""
"E130501","Renal Failure","An acute or chronic condition that is characterized by the inability of the kidneys to adequately filter the blood resulting in uremia and electrolyte imbalances.",,"","","E13|E1305|E130501","MedDRA:10038435:Renal failure","",""
"E1306","Uremia","Abnormally high concentration of non-protein nitrogen in the blood.",,"","","E13|E1306","MedDRA:10046369:Uremia","Kidney and Urinary Tract","Endocrine, Metabolism and Nutrition"
"E1307","Urethral Stenosis/Stricture","Narrowing of any part of the urethra. With or without affecting the flow of urine.",,"","","E13|E1307","MedDRA:10065584:Urethral stenosis","",""
"E1308","Urinary Frequency","Urination at short intervals; it may result from increased urine formation, decreased bladder capacity, or lower urinary tract irritation.",,"","","E13|E1308","MedDRA:10046539:Urinary frequency","",""
"E1309","Urinary Retention","Accumulation of urine within the bladder because of the inability to urinate.",,"","","E13|E1309","MedDRA:10046555:Urinary retention","",""
"E1310","Urinary Tract Infection","An inflammatory process affecting any part of the urinary tract, most commonly the bladder or the urethra.",,"","","E13|E1310","MedDRA:10046571:Urinary tract infection","Kidney and Urinary Tract","Infections"
"E131001","Kidney Infection","An inflammatory process affecting the kidney.",,"","","E13|E1310|E131001","MedDRA:10023424:Kidney infection","Kidney and Urinary Tract","Infections"
"E1311","Unspecified Kidney or Urinary Problem","The report describes a non-specific problem with the kidneys or urinary system. Note: Please use ""Appropriate Term / Code Not Available"" if the report describes a specific problem but the relevant term does not exist.",,"New","Term was added on 18 March 2020 for cases where the category of a health effect was reported but with no further details.","E13|E1311","","",""
"E14","Reproductive System and Breast","Reproductive System and Breast",,"Not selectable","Please use more detailed term within the hierarchy","E14","","",""
"E1210","Premature Menopause","Menopause occurring spontaneously before 40 years of age",,"New","Term was added on 18 March 2020 as an additional level 2 term for ""Endocrine, Metabolism and Nutrition"".","E14|E1210","MedDRA:10036601:Premature menopause","Endocrine, Metabolism and Nutrition","Reproductive System and Breast"
"E1401","Abnormal Vaginal Discharge","Secretions from the vagina with a smell, colour, or texture which is different from normal.",,"","","E14|E1401","MedDRA:10057094:Vaginal discharge abnormality","",""
"E1402","Breast Discomfort/Pain","Having pain, tenderness or discomfort in the breast.",,"","","E14|E1402","MedDRA:10006298:Breast pain","",""
"E1403","Breast Mass","Abnormality in the breast parenchyma, identified either by palpation or imaging. These abnormalities include calcifications, breast tissue distortion, presence of areas of density, and presence of benign or malignant tumors.",,"","","E14|E1403","MedDRA:10006272:Breast mass","",""
"E1404","Cervical Changes","Changes such as abnormal, pathological, benign, malignant, etc.",,"","","E14|E1404","MedDRA:10008351:Cervix disorder","Reproductive System and Breast","Investigations and Diagnostic Tests"
"E1405","Dyspareunia","Painful or difficult coitus.",,"","","E14|E1405","MedDRA:10013941:Dyspareunia","",""
"E1406","Fallopian Tube Perforation","A rupture in the fallopian tube due to traumatic or pathologic processes.",,"","","E14|E1406","MedDRA:10065790:Fallopian tube perforation","Reproductive System and Breast","Procedural Complications"
"E1407","Genital Bleeding","Abnormal bleeding from the genitalia.",,"","","E14|E1407","MedDRA:10071812:Genital bleeding","",""
"E140701","Intermenstrual Bleeding","Uterine bleeding that occurs during a time not associated with the normal menstrual period.",,"","","E14|E1407|E140701","MedDRA:10022559:Intermenstrual bleeding","",""
"E140702","Menorrhagia","Heavy or large blood loss during menses.",,"","","E14|E1407|E140702","MedDRA:10027313:Menorrhagia","",""
"E1408","Menstrual Irregularities","Deviations from the normal process; e.g. delayed, difficult, profuse, scanty, unusual bleeding, etc.",,"","","E14|E1408","MedDRA:10027333:Menstrual irregularity","",""
"E1409","Nipple Sensation Changes","Excessive sensitivity or changes in sensitivity in the nipple(s)",,"Modified (editorial)","Editorial change to the definition on 16 February 2021.","E14|E1409","MedDRA:10082498:Nipple sensation changes","",""
"E1410","Nipple Ulceration","Ulcer that develops in the nipple.",,"","","E14|E1410","MedDRA:10029424:Nipple ulceration","",""
"E1411","Pelvic Inflammatory Disease","Any pelvic infection involving the upper female genital tract beyond the cervix.",,"","","E14|E1411","MedDRA:10034254:Pelvic inflammatory disease","",""
"E1412","Rectovaginal Fistula","Abnormal connection between rectum and vagina.",,"Modified (editorial)","Editorial change to the definition on 16 February 2021.","E14|E1412","MedDRA:10051097:Rectovaginal fistula","",""
"E1413","Sexual Dysfunction","Difficulty, lack of desire, or pain associated with coitus.",,"","","E14|E1413","MedDRA:10040477:Sexual dysfunction","",""
"E141301","Erectile Dysfunction","Persistent or recurrent inability to achieve or to maintain an erection during sexual activity.",,"","","E14|E1413|E141301","MedDRA:10061461:Erectile dysfunction","",""
"E1414","Toxic Shock Syndrome","A rare acute life-threatening systemic bacterial noncontagious illness caused by staphylococcal exotoxins.",,"","","E14|E1414","MedDRA:10044248:Toxic shock syndrome","Reproductive System and Breast","Infections"
"E1415","Uterine Perforation","A rupture in the uterus due to traumatic or pathologic processes.",,"","","E14|E1415","MedDRA:10046810:Uterine perforation","Reproductive System and Breast","Procedural Complications"
"E1416","Vesicovaginal Fistula","Abnormal connection between vagina and bladder.",,"","","E14|E1416","MedDRA:10069086:Vesicovaginal fistula","",""
"E1417","Unspecified Reproductive System or Breast Problem","The report describes a non-specific problem with the breasts or reproductive system. Note: Please use ""Appropriate Term / Code Not Available"" if the report describes a specific problem but the relevant term does not exist.",,"New","Term was added on 18 March 2020 for cases where the category of a health effect was reported but with no further details.","E14|E1417","","",""
"E1506","Ectopic Pregnancy","Pregnancy condition that happens when there is a developing fetus or embryo outside the uterus.",,"","","E14|E1506","MedDRA:10014166:Ectopic pregnancy","Pregnancy, Childbirth and the Puerperium","Reproductive System and Breast"
"E1509","Incompetent Cervix","Cervix that is abnormally prone to dilate without contractions in the second trimester of pregnancy, resulting in premature expulsion of the fetus.",,"","","E14|E1509","MedDRA:10021632:Incompetent cervix","Pregnancy, Childbirth and the Puerperium","Reproductive System and Breast"
"E1519","Vaginal Mucosa Damage","Injury to vaginal mucosa.",,"","","E14|E1519","MedDRA:10080926:Vaginal mucosal damage","Pregnancy, Childbirth and the Puerperium","Reproductive System and Breast"
"E2341","Double Capsule","The presence of two distinct capsular layers around an implant with an intercapsular space",,"New","Term was added on 18 March 2020 as an additional level 2 term for ""Generalized Disorders"".","E14|E2341","","Generalized Disorders","Reproductive System and Breast"
"E15","Pregnancy, Childbirth and the Puerperium","Pregnancy, Childbirth and the Puerperium",,"Not selectable","Please use more detailed term within the hierarchy","E15","","",""
"E1501","Abortion","The unintentional or intentional loss of a pregnancy before 22 weeks gestation.",,"","","E15|E1501","MedDRA:10000210:Abortion","",""
"E150101","Complete Induced Abortion","Expulsion of all the products of conception following medical or surgical pregnancy termination.",,"","","E15|E1501|E150101","MedDRA:10060928:Abortion induced complete","",""
"E150102","Incomplete Induced Abortion","The uterus is not entirely emptied of products of conception following medical or surgical pregnancy termination.",,"","","E15|E1501|E150102","MedDRA:10053984:Abortion induced incomplete","",""
"E150103","Induced Abortion","Abortion brought on intentionally.",,"","","E15|E1501|E150103","MedDRA:10021716:Induced abortion","",""
"E150104","Missed Abortion","Retention in uterus of an abortus.",,"","","E15|E1501|E150104","MedDRA:10027704:Missed abortion","",""
"E150105","Spontaneous Abortion","Spontaneous expulsion of a human fetus before it is viable.",,"","","E15|E1501|E150105","MedDRA:10041687:Spontaneous abortion","",""
"E1502","Amnionitis","Inflammation of the amnion.",,"","","E15|E1502","MedDRA:10051242:Amnionitis","",""
"E1503","Cephalohematoma","A subperiosteal hemorrhage limited to the surface of one cranial bone, a usually benign condition seen in the newborn as a result of bone trauma.",,"","","E15|E1503","MedDRA:10060531:Cephalohematoma","",""
"E1504","Chorioamnionitis","An infection involving chorion, amnion and amniotic fluid; generally, there is also involve placental villi and from decidua.",,"","","E15|E1504","MedDRA:10008755:Chorioamnionitis","Pregnancy, Childbirth and the Puerperium","Infections"
"E1505","Congenital Defect/Deformity","Any abnormality either hereditary or due an influence that happen during the pregnancy until the moment of birth.",,"","","E15|E1505","MedDRA:10048305:Birth defects","Pregnancy, Childbirth and the Puerperium","Musculoskeletal System"
"E1506","Ectopic Pregnancy","Pregnancy condition that happens when there is a developing fetus or embryo outside the uterus.",,"","","E15|E1506","MedDRA:10014166:Ectopic pregnancy","Pregnancy, Childbirth and the Puerperium","Reproductive System and Breast"
"E1507","Fetal Distress","Signs or symptoms which may be indicative of distress to a fetus, which may include repetitive variable decelerations, fetal tachycardia or bradycardia, late decelerations, or low biophysical profile.",,"","","E15|E1507","MedDRA:10016486:Fetal distress","Pregnancy, Childbirth and the Puerperium","Heart"
"E1508","Hypoxia in Utero","Caused by conditions such as inadequate placental function (often abruptio placentae), preeclamptic toxicity, prolapse of the umbilical cord, or complications from anesthetic administration.",,"","","E15|E1508","MedDRA:10022748:Intra-uterine hypoxia","",""
"E1509","Incompetent Cervix","Cervix that is abnormally prone to dilate without contractions in the second trimester of pregnancy, resulting in premature expulsion of the fetus.",,"","","E15|E1509","MedDRA:10021632:Incompetent cervix","Pregnancy, Childbirth and the Puerperium","Reproductive System and Breast"
"E1510","Low Apgar Score","Any Apgar score less than seven. This may be the initial or a subsequent apgar score.",,"","","E15|E1510","MedDRA:10002944:Apgar score low","Pregnancy, Childbirth and the Puerperium","Investigations and Diagnostic Tests"
"E1511","Neonatal Deformities","Anatomic abnormality manifested during the neonatal period of physical or mechanical origin.",,"","","E15|E1511","MedDRA:10082494:Neonatal deformity","Pregnancy, Childbirth and the Puerperium","Musculoskeletal System"
"E1512","Neonatal Hearing Impairment","An abnormality that affects hearing within the first month after birth.",,"","","E15|E1512","MedDRA:10080921:Neonatal hearing impairment","Pregnancy, Childbirth and the Puerperium","Ear and Labyrinth"
"E151201","Complete Neonatal Hearing Loss","Complete loss of the ability to detect or understand sounds present in an infant within its first month after birth.",,"","","E15|E1512|E151201","MedDRA:10082499:Complete neonatal hearing loss","Pregnancy, Childbirth and the Puerperium","Ear and Labyrinth"
"E151202","Partial Neonatal Hearing loss","Partial loss of the ability to detect or understand sounds present in an infant within its first month after birth.",,"","","E15|E1512|E151202","MedDRA:10082496:Partial neonatal hearing loss","Pregnancy, Childbirth and the Puerperium","Ear and Labyrinth"
"E1513","Perinatal Brain Injury","Injury to the brain of a newborn infant occurring around the time of birth.",,"","","E15|E1513","MedDRA:10056392:Perinatal brain damage","Pregnancy, Childbirth and the Puerperium","Nervous System"
"E1514","Pregnancy with a Contraceptive Device","The woman became pregnant despite using a contraceptive device.",,"","","E15|E1514","MedDRA:10063130:Pregnancy with contraceptive device","",""
"E1515","Premature Labor","Delivery of a viable infant before the normal end of gestation.",,"","","E15|E1515","MedDRA:10036599:Premature labor","",""
"E1516","Respiratory Distress Syndrome of Newborns","A condition of the newborn marked by dyspnea with cyanosis.",,"","","E15|E1516","MedDRA:10038692:Respiratory distress syndrome in newborn","Pregnancy, Childbirth and the Puerperium","Respiratory System"
"E1517","Teratogenic Effects","Appearance of anomalies and/or developmental defects due to exposure to an agent that can disturb the development of an embryo or fetus.",,"","","E15|E1517","MedDRA:10043275:Teratogenicity","",""
"E1518","Toxins In Children","Children affected by toxins may be due to silicone breast implants and their effects on unborn children and from breastfeeding.",,"","","E15|E1518","MedDRA:10053487:Exposure to toxic agent","",""
"E1519","Vaginal Mucosa Damage","Injury to vaginal mucosa.",,"","","E15|E1519","MedDRA:10080926:Vaginal mucosal damage","Pregnancy, Childbirth and the Puerperium","Reproductive System and Breast"
"E190103","Toxemia","The condition resulting from the spread of bacterial products (toxins) by the bloodstream.",,"","","E15|E190103","MedDRA:10059857:Toxemia","Infections","Pregnancy, Childbirth and the Puerperium"
"E16","Musculoskeletal System","Musculoskeletal System",,"Not selectable","Please use more detailed term within the hierarchy","E16","","",""
"E1505","Congenital Defect/Deformity","Any abnormality either hereditary or due an influence that happen during the pregnancy until the moment of birth.",,"","","E16|E1505","MedDRA:10048305:Birth defects","Pregnancy, Childbirth and the Puerperium","Musculoskeletal System"
"E1511","Neonatal Deformities","Anatomic abnormality manifested during the neonatal period of physical or mechanical origin.",,"","","E16|E1511","MedDRA:10082494:Neonatal deformity","Pregnancy, Childbirth and the Puerperium","Musculoskeletal System"
"E1601","Arthralgia","Pain in a joint.",,"","","E16|E1601","MedDRA:10003239:Arthralgia","",""
"E1602","Arthritis","An inflammatory process affecting a joint.",,"","","E16|E1602","MedDRA:10003246:Arthritis","",""
